{
  "id": "dispel-evil-and-good",
  "name": {
    "en": "Dispel Evil and Good",
    "it": "Dissolvere il Bene e il Male"
  },
  "level": 5,
  "school": "Abjuration",
  "classes": [
    "Cleric",
    "Paladin"
  ],
  "ritual_caster_feat": false,
  "casting_time": "1 action",
  "range": "Self",
  "duration": "Up to 1 minute",
  "ritual": false,
  "concentration": true,
  "components": {
    "verbal": true,
    "somatic": true,
    "material": true,
    "material_desc": "Holy water or powdered silver and iron."
  },
  "source": {
    "source_edition": "SRD 5.1",
    "source_book": "Player's Handbook (SRD 5.1)",
    "api_ref": "v1/spells/dispel-evil-and-good"
  },
  "descrizione": "Shimmering energy surrounds and protects you from fey, undead, and creatures originating from beyond the Material Plane. For the duration, celestials, elementals, fey, fiends, and undead have disadvantage on attack rolls against you. You can end the spell early by using either of the following special functions.\n\n**Break Enchantment.** As your action, you touch a creature you can reach that is charmed, frightened, or possessed by a celestial, an elemental, a fey, a fiend, or an undead. The creature you touch is no longer charmed, frightened, or possessed by such creatures.\n\n**Dismissal.** As your action, make a melee spell attack against a celestial, an elemental, a fey, a fiend, or an undead you can reach. On a hit, you attempt to drive the creature back to its home plane. The creature must succeed on a charisma saving throw or be sent back to its home plane (if it isn't there already). If they aren't on their home plane, undead are sent to the Shadowfell, and fey are sent to the Feywild.",
  "a_livelli_superiori": null,
  "note": []
}
