{
  "id": "fog-cloud",
  "name": {
    "en": "Fog Cloud",
    "it": "Nube di Nebbia"
  },
  "level": 1,
  "school": "Conjuration",
  "classes": [
    "Cleric",
    "Druid",
    "Ranger",
    "Sorcerer",
    "Wizard"
  ],
  "ritual_caster_feat": false,
  "casting_time": "1 action",
  "range": "120 feet",
  "duration": "Up to 1 hour",
  "ritual": false,
  "concentration": true,
  "components": {
    "verbal": true,
    "somatic": true,
    "material": false,
    "material_desc": null
  },
  "source": {
    "source_edition": "SRD 5.1",
    "source_book": "Player's Handbook (SRD 5.1)",
    "api_ref": "v1/spells/fog-cloud"
  },
  "descrizione": "You create a 20-foot-radius sphere of fog centered on a point within range. The sphere spreads around corners, and its area is heavily obscured. It lasts for the duration or until a wind of moderate or greater speed (at least 10 miles per hour) disperses it.",
  "a_livelli_superiori": "When you cast this spell using a spell slot of 2nd level or higher, the radius of the fog increases by 20 feet for each slot level above 1st.",
  "note": []
}
