{
  "id": "divination",
  "name": {
    "en": "Divination",
    "it": "Divinazione"
  },
  "level": 4,
  "school": "Divination",
  "classes": [
    "Cleric",
    "Druid"
  ],
  "ritual_caster_feat": true,
  "casting_time": "1 action",
  "range": "Self",
  "duration": "Instantaneous",
  "ritual": true,
  "concentration": false,
  "components": {
    "verbal": true,
    "somatic": true,
    "material": true,
    "material_desc": "Incense and a sacrificial offering appropriate to your religion, together worth at least 25gp, which the spell consumes."
  },
  "source": {
    "source_edition": "SRD 5.1",
    "source_book": "Player's Handbook (SRD 5.1)",
    "api_ref": "v1/spells/divination"
  },
  "descrizione": "Your magic and an offering put you in contact with a god or a god's servants. You ask a single question concerning a specific goal, event, or activity to occur within 7 days. The DM offers a truthful reply. The reply might be a short phrase, a cryptic rhyme, or an omen. The spell doesn't take into account any possible circumstances that might change the outcome, such as the casting of additional spells or the loss or gain of a companion. If you cast the spell two or more times before finishing your next long rest, there is a cumulative 25 percent chance for each casting after the first that you get a random reading. The DM makes this roll in secret.",
  "a_livelli_superiori": null,
  "note": []
}
