{
  "id": "legend-lore",
  "name": {
    "en": "Legend Lore",
    "it": "Sapienza Leggendaria"
  },
  "level": 5,
  "school": "Divination",
  "classes": [
    "Bard",
    "Cleric",
    "Wizard"
  ],
  "ritual_caster_feat": false,
  "casting_time": "10 minutes",
  "range": "Self",
  "duration": "Instantaneous",
  "ritual": false,
  "concentration": false,
  "components": {
    "verbal": true,
    "somatic": true,
    "material": true,
    "material_desc": "Incense worth 250 inches that fate consumes and four sticks of ivory worth 50 gp each."
  },
  "source": {
    "source_edition": "SRD 5.1",
    "source_book": "Player's Handbook (SRD 5.1)",
    "api_ref": "v1/spells/legend-lore"
  },
  "descrizione": "Name or describe a person, place, or object. The spell brings to your mind a brief summary of the significant lore about the thing you named. The lore might consist of current tales, forgotten stories, or even secret lore that has never been widely known. If the thing you named isn't of legendary importance, you gain no information. The more information you already have about the thing, the more precise and detailed the information you receive is. The information you learn is accurate but might be couched in figurative language. For example, if you have a mysterious magic axe on hand, the spell might yield this information:  \"Woe to the evildoer whose hand touches the axe, for even the haft slices the hand of the evil ones. Only a true Child of Stone, lover and beloved of Moradin, may awaken the true powers of the axe, and only with the sacred word Rudnogg on the lips.\"",
  "a_livelli_superiori": null,
  "note": []
}
