{
  "id": "resilient-sphere",
  "name": {
    "en": "Resilient Sphere",
    "it": "Sfera Resiliente"
  },
  "level": 4,
  "school": "Evocation",
  "classes": [
    "Wizard"
  ],
  "ritual_caster_feat": false,
  "casting_time": "1 action",
  "range": "30 feet",
  "duration": "Up to 1 minute",
  "ritual": false,
  "concentration": true,
  "components": {
    "verbal": true,
    "somatic": true,
    "material": true,
    "material_desc": "A hemispherical piece of clear crystal and a matching hemispherical piece of gum arabic."
  },
  "source": {
    "source_edition": "SRD 5.1",
    "source_book": "Player's Handbook (SRD 5.1)",
    "api_ref": "v1/spells/resilient-sphere"
  },
  "descrizione": "A sphere of shimmering force encloses a creature or object of Large size or smaller within range. An unwilling creature must make a dexterity saving throw. On a failed save, the creature is enclosed for the duration. Nothing-not physical objects, energy, or other spell effects-can pass through the barrier, in or out, though a creature in the sphere can breathe there. The sphere is immune to all damage, and a creature or object inside can't be damaged by attacks or effects originating from outside, nor can a creature inside the sphere damage anything outside it. The sphere is weightless and just large enough to contain the creature or object inside. An enclosed creature can use its action to push against the sphere's walls and thus roll the sphere at up to half the creature's speed. Similarly, the globe can be picked up and moved by other creatures. A disintegrate spell targeting the globe destroys it without harming anything inside it.",
  "a_livelli_superiori": null,
  "note": []
}
