{
  "id": "antilife-shell",
  "name": {
    "en": "Antilife Shell",
    "it": "Guscio Anti-vita"
  },
  "level": 5,
  "school": "Abjuration",
  "classes": [
    "Druid"
  ],
  "ritual_caster_feat": false,
  "casting_time": "1 action",
  "range": "Self",
  "duration": "Up to 1 hour",
  "ritual": false,
  "concentration": true,
  "components": {
    "verbal": true,
    "somatic": true,
    "material": false,
    "material_desc": null
  },
  "source": {
    "source_edition": "SRD 5.1",
    "source_book": "Player's Handbook (SRD 5.1)",
    "api_ref": "v1/spells/antilife-shell"
  },
  "descrizione": "A shimmering barrier extends out from you in a 10-foot radius and moves with you, remaining centered on you and hedging out creatures other than undead and constructs. The barrier lasts for the duration. The barrier prevents an affected creature from passing or reaching through. An affected creature can cast spells or make attacks with ranged or reach weapons through the barrier. If you move so that an affected creature is forced to pass through the barrier, the spell ends.",
  "a_livelli_superiori": null,
  "note": []
}
