{
  "id": "produce-flame",
  "name": {
    "en": "Produce Flame",
    "it": "Produrre Fiamma"
  },
  "level": 0,
  "school": "Conjuration",
  "classes": [
    "Druid"
  ],
  "ritual_caster_feat": false,
  "casting_time": "1 action",
  "range": "Self",
  "duration": "10 minutes",
  "ritual": false,
  "concentration": false,
  "components": {
    "verbal": true,
    "somatic": true,
    "material": false,
    "material_desc": null
  },
  "source": {
    "source_edition": "SRD 5.1",
    "source_book": "Player's Handbook (SRD 5.1)",
    "api_ref": "v1/spells/produce-flame"
  },
  "descrizione": "A flickering flame appears in your hand. The flame remains there for the duration and harms neither you nor your equipment. The flame sheds bright light in a 10-foot radius and dim light for an additional 10 feet. The spell ends if you dismiss it as an action or if you cast it again. You can also attack with the flame, although doing so ends the spell. When you cast this spell, or as an action on a later turn, you can hurl the flame at a creature within 30 feet of you. Make a ranged spell attack. On a hit, the target takes 1d8 fire damage.",
  "a_livelli_superiori": "This spell's damage increases by 1d8 when you reach 5th level (2d8), 11th level (3d8), and 17th level (4d8).",
  "note": []
}
