{
  "id": "blur",
  "name": {
    "en": "Blur",
    "it": "Offuscamento"
  },
  "level": 2,
  "school": "Illusion",
  "classes": [
    "Druid",
    "Sorcerer",
    "Wizard"
  ],
  "ritual_caster_feat": false,
  "casting_time": "1 action",
  "range": "Self",
  "duration": "Up to 1 minute",
  "ritual": false,
  "concentration": true,
  "components": {
    "verbal": true,
    "somatic": false,
    "material": false,
    "material_desc": null
  },
  "source": {
    "source_edition": "SRD 5.1",
    "source_book": "Player's Handbook (SRD 5.1)",
    "api_ref": "v1/spells/blur"
  },
  "descrizione": "Your body becomes blurred, shifting and wavering to all who can see you. For the duration, any creature has disadvantage on attack rolls against you. An attacker is immune to this effect if it doesn't rely on sight, as with blindsight, or can see through illusions, as with truesight.",
  "a_livelli_superiori": null,
  "note": []
}
