{
  "id": "eldritch-blast",
  "name": {
    "en": "Eldritch Blast",
    "it": "Esplosione Occulta"
  },
  "level": 0,
  "school": "Evocation",
  "classes": [
    "Warlock"
  ],
  "ritual_caster_feat": false,
  "casting_time": "1 action",
  "range": "120 feet",
  "duration": "Instantaneous",
  "ritual": false,
  "concentration": false,
  "components": {
    "verbal": true,
    "somatic": true,
    "material": false,
    "material_desc": null
  },
  "source": {
    "source_edition": "SRD 5.1",
    "source_book": "Player's Handbook (SRD 5.1)",
    "api_ref": "v1/spells/eldritch-blast"
  },
  "descrizione": "A beam of crackling energy streaks toward a creature within range. Make a ranged spell attack against the target. On a hit, the target takes 1d10 force damage. The spell creates more than one beam when you reach higher levels: two beams at 5th level, three beams at 11th level, and four beams at 17th level. You can direct the beams at the same target or at different ones. Make a separate attack roll for each beam.",
  "a_livelli_superiori": null,
  "note": []
}
