{
  "id": "protection-from-poison",
  "name": {
    "en": "Protection from Poison",
    "it": "Protezione dal Veleno"
  },
  "level": 2,
  "school": "Abjuration",
  "classes": [
    "Cleric",
    "Druid",
    "Paladin",
    "Ranger"
  ],
  "ritual_caster_feat": false,
  "casting_time": "1 action",
  "range": "Touch",
  "duration": "1 hour",
  "ritual": false,
  "concentration": false,
  "components": {
    "verbal": true,
    "somatic": true,
    "material": false,
    "material_desc": null
  },
  "source": {
    "source_edition": "SRD 5.1",
    "source_book": "Player's Handbook (SRD 5.1)",
    "api_ref": "v1/spells/protection-from-poison"
  },
  "descrizione": "You touch a creature. If it is poisoned, you neutralize the poison. If more than one poison afflicts the target, you neutralize one poison that you know is present, or you neutralize one at random. For the duration, the target has advantage on saving throws against being poisoned, and it has resistance to poison damage.",
  "a_livelli_superiori": null,
  "note": []
}
