{
  "id": "detect-magic",
  "name": {
    "en": "Detect Magic",
    "it": "Individuare la Magia"
  },
  "level": 1,
  "school": "Divination",
  "classes": [
    "Bard",
    "Cleric",
    "Druid",
    "Paladin",
    "Ranger",
    "Sorcerer",
    "Wizard"
  ],
  "ritual_caster_feat": true,
  "casting_time": "1 action",
  "range": "Self",
  "duration": "Up to 10 minutes",
  "ritual": true,
  "concentration": true,
  "components": {
    "verbal": true,
    "somatic": true,
    "material": false,
    "material_desc": null
  },
  "source": {
    "source_edition": "SRD 5.1",
    "source_book": "Player's Handbook (SRD 5.1)",
    "api_ref": "v1/spells/detect-magic"
  },
  "descrizione": "For the duration, you sense the presence of magic within 30 feet of you. If you sense magic in this way, you can use your action to see a faint aura around any visible creature or object in the area that bears magic, and you learn its school of magic, if any. The spell can penetrate most barriers, but it is blocked by 1 foot of stone, 1 inch of common metal, a thin sheet of lead, or 3 feet of wood or dirt.",
  "a_livelli_superiori": null,
  "note": []
}
