{
  "id": "tiny-hut",
  "name": {
    "en": "Tiny Hut",
    "it": "Piccolo Rifugio"
  },
  "level": 3,
  "school": "Evocation",
  "classes": [
    "Bard",
    "Wizard"
  ],
  "ritual_caster_feat": true,
  "casting_time": "1 minute",
  "range": "Self",
  "duration": "8 hours",
  "ritual": true,
  "concentration": false,
  "components": {
    "verbal": true,
    "somatic": true,
    "material": true,
    "material_desc": "A small crystal bead."
  },
  "source": {
    "source_edition": "SRD 5.1",
    "source_book": "Player's Handbook (SRD 5.1)",
    "api_ref": "v1/spells/tiny-hut"
  },
  "descrizione": "A 10-foot-radius immobile dome of force springs into existence around and above you and remains stationary for the duration. The spell ends if you leave its area. Nine creatures of Medium size or smaller can fit inside the dome with you. The spell fails if its area includes a larger creature or more than nine creatures. Creatures and objects within the dome when you cast this spell can move through it freely. All other creatures and objects are barred from passing through it. Spells and other magical effects can't extend through the dome or be cast through it. The atmosphere inside the space is comfortable and dry, regardless of the weather outside. Until the spell ends, you can command the interior to become dimly lit or dark. The dome is opaque from the outside, of any color you choose, but it is transparent from the inside.",
  "a_livelli_superiori": null,
  "note": []
}
